question,answer
Problemas de memória,"Assim como a saúde mental, existe também um outro fator que pode afetar o cérebro que é a perda de memória. Da mesma forma que o corpo, o cérebro também precisa de estímulos para se manter ativo e saudável. E para quem sofre com a perda de memória e de concentração, uma das soluções podem ser os exercícios neuróbicos. Exemplos de exercicios são colocar o relógio de pulso no braço que não é o dominante, escrever com a mão não dominante, tomar banho com a luz apagada, ler de cabeça para baixo, realizam um esforço neurológico maior, que favorece o processo de fortalecimento e criação de novas redes neurais. Ou seja, “tudo o que a gente fizer que for diferente do normal vai favorecer esse processo”."
Tristeza sem motivo aparente,"Em alguns momentos, a tristeza pode estar associada a questões do nosso inconsciente. Ela pode se manifestar quando recebemos estímulos externos que nos afetam sem que nosso lado racional perceba. Nesses casos, a tristeza pode acontecer por conta de sentimentos como o de saudades, raiva, sono e até fome. É um sentimento normal que não afeta nossa produtividade. Mesmo tristes conseguimos fazer as tarefas simples do dia a dia. A tristeza comum basicamente é um sentimento passageiro. Nos sentimos sem ânimo, insatisfeitos e até com vontade de chorar. Porém, essa é apenas uma situação ruim, que deve melhorar em um ou dois dias. Já na depressão a intensidade, a duração e o impacto do sentimento de tristeza são bem maiores. Além disso, a depressão inclui não só a tristeza, mas também angústia, apatia, pensamentos pessimistas, choro, problemas com sono. Só um profissional pode avaliar se há realmente um quadro de depressão e, consequentemente, a necessidade do uso de medicamentos, combinado com a psicoterapia."
Falta de paciência e irritação,"A irritabilidade é o estado emocional ou reação ocasionados por estímulos que provoquem raiva ou frustração, irritabilidade também causa sintomas emocionais. Dentre os principais estão: Intolerância e impaciência: pessoas irritadas costumam ter um baixo nível de tolerância e paciência. Por isso, qualquer mínimo motivo pode tirá-las do sério. Surto emocional: a irritabilidade excessiva pode fazer a pessoa passar do limite. Ou seja, gerar descontrole emocional, reações exageradas e atitudes extremistas. Raiva e agressividade: o indivíduo muito nervoso e irritado pode se tornar agressivo em todos os sentidos. A raiva pode dificultar o raciocínio lógico e resultar em comportamentos rudes, que podem envolver até o uso da força física. Pensamentos negativos: a pessoa irritada entra em um ciclo vicioso, pois a irritação constante gera pensamentos negativos. Quanto mais negatividade, maior é a tendência a desenvolver falta de paciência e irritabilidade."
Problemas digestivos,"Problemas gastrointestinais também podem provocar ansiedade, tornando ainda mais difícil vida de quem sofre com os sintomas. Mostrar como essas condições estão interligadas pode ajudar quem sofre com elas, pois, em muitos casos, o tratamento psicológico pode melhorar os sintomas digestivos. É pela forte conexão entre intestino e cérebro que o trato gastrointestinal é tão sensível à emoção. Por essa comunicação entre as duas áreas distintas do organismo, é comum que a ansiedade, quando exacerbada, desencadeie ou agrave problemas como azia, indigestão, prisão de ventre, gases e diarreia – sintomas que atrapalham o dia a dia de quem convive com o quadro. Se você está estressado ou ansioso, isso pode fazer seu intestino desacelerar ou acelerar. Para uma digestão saudável, você precisa de bastante fibra, líquidos e exercícios regulares. Alimentos saudáveis para o intestino incluem, por exemplo, frutas, vegetais e grãos integrais e leguminosas, além do consumo de bastante água."
"Dor de cabeça constante, enxaqueca","Tanto a enxaqueca quanto esses transtornos mentais podem estar relacionados a diversas alterações neuroquímicas no cérebro. Por exemplo, a baixa de serotonina, que é observada em pacientes depressivos e também é vista nos indivíduos durante uma crise desse tipo de dor de cabeça. Por isso, os pacientes com depressão e ansiedade e que possuem predisposição genética têm maior chance e terem crises de enxaqueca. Assim como os transtornos mentais podem desencadear a enxaqueca, eles também podem ser consequências dessa intensa dor de cabeça frequente. Por ser uma doença muito incapacitante, a enxaqueca costuma despertar sentimentos de impotência e de tristeza. Isso porque, as dores intensas atrapalham a execução de tarefas e prejudicam demais a qualidade de vida. É muito comum que os enxaquecosos possuam indícios de depressão e ansiedade. As crises podem aparecer em momentos inesperados e afetam diretamente o desempenho no trabalho e estudos, por exemplo. Por isso, é importante aprender a manejar melhor os sentimentos, comportamentos e hábitos de vida. Assim, é mais fácil de evitar os gatilhos emocionais que podem causar essa dor de cabeça intensa."
Comportamento incomum,"Comportamentos incomuns podem ser um sinal de alerta da sua saúde mental, transtorno de humor é a segunda doença mais comum entre todos os transtornos mentais, sendo um sinal de que a sua saúde mental como um todo não anda muito bem. Atitudes como se isolar de todos, evitar sair com os amigos, de participar de festas; podem não ser um bom sinal e podem ser sintomas relacionados à depressão, transtorno bipolar, ansiedade, entre outros. Os maiores sinais de alerta de uma doença mental é a mudança de comportamento, como nos casos que uma pessoa que é bem falante e, do nada, passa a ficar calada ou uma pessoa que seja considerada como introvertida, começa a ficar de uma hora para outra, estranhamente extrovertida."
